{
  "schemaVersion": 1,
  "auditId": "valid-audit",
  "technologies": ["HTML", "CSS", "JavaScript"],
  "views": [
    {
      "id": "home",
      "name": "Inicio",
      "path": "/",
      "kind": "Página de entrada",
      "essential": true,
      "states": [
        { "id": "default", "name": "Estado inicial" },
        {
          "id": "menu-open",
          "name": "Más opciones abierto",
          "trigger": "Activar Más opciones"
        }
      ]
    }
  ],
  "processes": []
}
